{
  "schema_version": "1.0.0",
  "schema": "https://sweetspot.local/schemas/submission-bundle/1.0.0-inline",
  "kind": "sma.community-submission-bundle",
  "created_at": "2026-01-01T00:00:00Z",
  "brick": {
    "id": "xxx",
    "name": "x",
    "version": "x",
    "status": "x"
  },
  "files": [
    {
      "path": "files/0-manifest",
      "role": "manifest",
      "bytes": 1,
      "sha256": "aaaaaaaaaaaaaaaaaaaaaaaaaaaaaaaaaaaaaaaaaaaaaaaaaaaaaaaaaaaaaaaa"
    },
    {
      "path": "files/1-source",
      "role": "source",
      "bytes": 1,
      "sha256": "aaaaaaaaaaaaaaaaaaaaaaaaaaaaaaaaaaaaaaaaaaaaaaaaaaaaaaaaaaaaaaaa"
    },
    {
      "path": "files/2-attestation",
      "role": "attestation",
      "bytes": 1,
      "sha256": "aaaaaaaaaaaaaaaaaaaaaaaaaaaaaaaaaaaaaaaaaaaaaaaaaaaaaaaaaaaaaaaa"
    },
    {
      "path": "files/3-checklist",
      "role": "checklist",
      "bytes": 1,
      "sha256": "aaaaaaaaaaaaaaaaaaaaaaaaaaaaaaaaaaaaaaaaaaaaaaaaaaaaaaaaaaaaaaaa"
    }
  ],
  "verification": {
    "digest": "sha256",
    "manifest_validator": "tools/sma-validate.ts",
    "manifest_warning_count": 0,
    "gates": [
      {
        "command": "npm run gate:all",
        "status": 0,
        "stdout_sha256": "aaaaaaaaaaaaaaaaaaaaaaaaaaaaaaaaaaaaaaaaaaaaaaaaaaaaaaaaaaaaaaaa",
        "stderr_sha256": "aaaaaaaaaaaaaaaaaaaaaaaaaaaaaaaaaaaaaaaaaaaaaaaaaaaaaaaaaaaaaaaa"
      },
      {
        "command": "npm run gate:leaks",
        "status": 0,
        "stdout_sha256": "aaaaaaaaaaaaaaaaaaaaaaaaaaaaaaaaaaaaaaaaaaaaaaaaaaaaaaaaaaaaaaaa",
        "stderr_sha256": "aaaaaaaaaaaaaaaaaaaaaaaaaaaaaaaaaaaaaaaaaaaaaaaaaaaaaaaaaaaaaaaa"
      }
    ]
  }
}
